{
  "$schema": "https://github.com/TakashiSasaki/templates/raw/refs/heads/modeling/schemas/resource-record-0.1.schema.json",
  "id": "dcat",
  "recordRevision": 1,
  "recordAuthority": "modeling",
  "resourceId": "https://www.w3.org/TR/vocab-dcat-3/",
  "identityBasis": "upstream-entrypoint",
  "ownership": "external",
  "normativeAuthority": {
    "name": "World Wide Web Consortium (W3C)",
    "id": "https://www.w3.org/"
  },
  "canonicalLanguage": "en",
  "title": "Data Catalog Vocabulary (DCAT)",
  "description": "Vocabulary for interoperable and federated catalogs; resource descriptions are not themselves ownership transfers.",
  "kinds": [
    "vocabulary",
    "specification"
  ],
  "homepage": "https://www.w3.org/TR/vocab-dcat-3/",
  "namespaces": [
    "http://www.w3.org/ns/dcat#"
  ],
  "editions": [
    {
      "id": "https://www.w3.org/TR/2024/REC-vocab-dcat-3-20240822/",
      "label": "3",
      "status": "W3C Recommendation",
      "source": "https://www.w3.org/TR/vocab-dcat-3/",
      "notes": "Named edition for identification, not a claim that it is the newest edition."
    }
  ],
  "distributions": [
    {
      "id": "dcat-documentation",
      "edition": "https://www.w3.org/TR/2024/REC-vocab-dcat-3-20240822/",
      "role": "documentation",
      "mediaType": "text/html",
      "language": "en",
      "access": "public",
      "rights": {
        "assessment": "not-assessed",
        "license": null,
        "source": "https://www.w3.org/TR/vocab-dcat-3/"
      },
      "retrieval": {
        "mode": "reference",
        "accessUrl": "https://www.w3.org/TR/vocab-dcat-3/",
        "downloadUrl": null,
        "bytePin": null
      }
    }
  ],
  "relationships": [],
  "registration": {
    "purpose": "discovery",
    "adoption": "not-adopted",
    "endorsement": "not-assessed",
    "externalContent": "reference-only"
  },
  "provenance": {
    "recordedOn": "2026-09-17",
    "sourceChecks": [
      {
        "url": "https://www.w3.org/TR/vocab-dcat-3/",
        "state": "metadata-observed",
        "observedOn": "2026-09-17",
        "scope": "Landing-page/specification metadata only; no distribution bytes, legal clearance, current-latest guarantee, or implementation conformance was verified."
      }
    ]
  },
  "notes": [
    "Do not classify every specification as a Dataset merely to use dcat:distribution.",
    "A catalog can be a discovery projection or an explicitly normative inventory; declare which."
  ]
}
