{
  "$schema": "https://github.com/TakashiSasaki/templates/raw/refs/heads/modeling/schemas/resource-record-0.1.schema.json",
  "id": "prof",
  "recordRevision": 1,
  "recordAuthority": "modeling",
  "resourceId": "https://www.w3.org/TR/dx-prof/",
  "identityBasis": "upstream-entrypoint",
  "ownership": "external",
  "normativeAuthority": {
    "name": "World Wide Web Consortium (W3C)",
    "id": "https://www.w3.org/"
  },
  "canonicalLanguage": "en",
  "title": "The Profiles Vocabulary (PROF)",
  "description": "Describes profiles, their bases, and the roles of supporting resources.",
  "kinds": [
    "vocabulary"
  ],
  "homepage": "https://www.w3.org/TR/dx-prof/",
  "namespaces": [
    "http://www.w3.org/ns/dx/prof/"
  ],
  "editions": [
    {
      "id": "https://www.w3.org/TR/2019/NOTE-dx-prof-20191218/",
      "label": "2019-12-18",
      "status": "W3C Working Group Note",
      "source": "https://www.w3.org/TR/dx-prof/",
      "notes": "Named edition for identification, not a claim that it is the newest edition."
    }
  ],
  "distributions": [
    {
      "id": "prof-documentation",
      "edition": "https://www.w3.org/TR/2019/NOTE-dx-prof-20191218/",
      "role": "documentation",
      "mediaType": "text/html",
      "language": "en",
      "access": "public",
      "rights": {
        "assessment": "not-assessed",
        "license": null,
        "source": "https://www.w3.org/TR/dx-prof/"
      },
      "retrieval": {
        "mode": "reference",
        "accessUrl": "https://www.w3.org/TR/dx-prof/",
        "downloadUrl": null,
        "bytePin": null
      }
    }
  ],
  "relationships": [],
  "registration": {
    "purpose": "discovery",
    "adoption": "not-adopted",
    "endorsement": "not-assessed",
    "externalContent": "reference-only"
  },
  "provenance": {
    "recordedOn": "2026-09-17",
    "sourceChecks": [
      {
        "url": "https://www.w3.org/TR/dx-prof/",
        "state": "metadata-observed",
        "observedOn": "2026-09-17",
        "scope": "Landing-page/specification metadata only; no distribution bytes, legal clearance, current-latest guarantee, or implementation conformance was verified."
      }
    ]
  },
  "notes": [
    "Profile conformance must preserve conformance to its base; mere reuse, extension, or resemblance does not establish isProfileOf.",
    "The registered publication is a Note, not a W3C Recommendation."
  ]
}
