{
  "$schema": "https://github.com/TakashiSasaki/templates/raw/refs/heads/modeling/schemas/resource-record-0.1.schema.json",
  "id": "spdx",
  "recordRevision": 2,
  "recordAuthority": "modeling",
  "resourceId": "https://spdx.org/licenses/",
  "identityBasis": "upstream-entrypoint",
  "ownership": "external",
  "normativeAuthority": {
    "name": "SPDX project",
    "id": "https://spdx.dev/"
  },
  "canonicalLanguage": "en",
  "title": "SPDX License List",
  "description": "Controlled identifiers and metadata for licenses and exceptions.",
  "kinds": [
    "vocabulary"
  ],
  "homepage": "https://spdx.org/licenses/",
  "namespaces": [],
  "editions": [],
  "distributions": [
    {
      "id": "spdx-documentation",
      "edition": null,
      "role": "documentation",
      "mediaType": "text/html",
      "language": "en",
      "access": "public",
      "rights": {
        "assessment": "not-assessed",
        "license": null,
        "source": "https://spdx.org/licenses/"
      },
      "retrieval": {
        "mode": "reference",
        "accessUrl": "https://spdx.org/licenses/",
        "downloadUrl": null,
        "bytePin": null
      }
    }
  ],
  "relationships": [],
  "registration": {
    "purpose": "discovery",
    "adoption": "not-adopted",
    "endorsement": "not-assessed",
    "externalContent": "reference-only"
  },
  "provenance": {
    "recordedOn": "2026-09-17",
    "sourceChecks": [
      {
        "url": "https://spdx.org/licenses/",
        "state": "metadata-observed",
        "observedOn": "2026-09-17",
        "scope": "Primary-source page metadata observed; no distribution bytes, legal clearance, current-latest guarantee, or implementation conformance was verified."
      }
    ]
  },
  "notes": [
    "A license identifier describes a license; it is not itself a determination that the license covers a particular resource.",
    "Select an exact list release when adopting it. No current release number is asserted here."
  ]
}
